Attribute,Description,Valid Values,DependsOn,Properties,Required,Parent,DependsOn Component,Source,Validation Rules
Component,Type of submitted information.,,,,TRUE,,,,
Genes,A gene in entrez,,"Component, EntrezId",EntrezId,,,,,
EntrezId,gene entrez id,,,,TRUE,,,,int::inRange 0 10000000000 error
samples,A patients specific sample,,"Component, sample_name",SampleName,,,,,
sample_name,The name of a sample,,,,TRUE,,,,str
GenesToSamples,gene to sample relationship,,"Component, BulkRNAExpression, GenesEntrezId, SamplesSampleName",BulkRNAExpression,,,"Genes, samples",,
BulkRNAExpression,Bulk RNA expression value,,,,,,,,num::inRange 0 10000000000 error
GenesEntrezId,,,,,TRUE,,,,matchAtLeastOne Genes.EntrezId set error
SamplesSampleName,,,,,TRUE,,,,matchAtLeastOne samples.sample_name set error
